entry,part_of_speech,korean_meaning,example_sentence
pacify,v.,진정시키다,The government sent troops to pacify the rebellious region.
foolproof,adj.,식은죽먹기의,"The new security system is designed to be foolproof, so no one can break in."
paramount,adj.,최고의,"In medicine, patient safety is of paramount importance."
flattery,adj.,아첨,Don’t be fooled by his flattery; he just wants something from you.
belligerent,adj.,"호전적인, 적대적인",The two countries adopted a belligerent stance before signing the peace treaty.
inimical,adj.,해로운,His inimical attitude made cooperation impossible.
soar,n.,솟구치다,Bitcoin prices soared after the government announced new regulations.
ominous,adj.,불길한,"His tone sounded ominous, as if he knew something terrible was coming."
sagacious,adj.,영리한,The sagacious leader foresaw the crisis and prepared early.
evergreen,v.,상록수,“Imagine” by John Lennon is an evergreen classic.
illustrious,adj.,저명한,The hall was filled with portraits of illustrious leaders from the past.
corpulent,adj.,뚱뚱한,"He was once athletic, but years of indulgence made him corpulent."
delinquent,adj.,"비행의, 연체된","The delinquent student was suspended for skipping classes too often."
consulate,v.,영사관,The embassy sent a consulate to assist the stranded tourists.
abduct,v.,유괴하다,The abducted child was found safe and sound after a week of negotiations.
protract,v.,연장하다,The project was extended to accommodate additional features.
defiant,adj.,반항하는,The defiant teenager refused to apologize for his misbehavior.
stand a person up,v.,기다리게 하다,He stood me up at the restaurant without any explanation.
inalienable,adj.,양도할 수 없는,The king’s decree on the inalienable rights of citizens was met with widespread support.
equanimity,adj.,평정,The diplomat maintained his equanimity during the tense negotiations.
phoney,adj.,"가짜의, 가짜",The phoney smile on his face was not genuine.
credulous,adj.,"잘 믿는, 잘 속는",He was too credulous to believe the stranger’s story.
meteorology,n.,기상학,Meteorology is the study of the atmosphere and its weather patterns.
gratitude,n.,고마움,I have a deep gratitude for your kindness and support.
drought,n.,가뭄,"The drought affected the entire region, leading to water shortages and crop failures."
pedigree,n.,족보,The dog’s pedigree traced back to a long line of champion show dogs.
deliberation,n.,"심의, 숙고",The team had a thorough deliberation before making a decision.
implication,n.,"영향, 함축",The controversial decision had far-reaching implications for the entire country.
far-fetched,n.,설득력 없는,"The theory was far-fetched and not supported by any evidence."
infringe,v.,위반하다,The company infringed on the patent by using the same technology without permission.
peer,n.,"또래, 동료",Our peers are often the first to know about new trends and ideas.
induce,v.,유발하다,The government induced the citizens to buy government bonds by offering low-interest rates.
sovereignty,adj.,"주권, 통치권, 자주권",The country’s sovereignty was violated when the foreign military forces invaded.
expediency,n.,편의성,"In politics, expediency often trumps principle."
contagion,n.,"전염, 전염병","The outbreak of the disease spread like a contagion through the population."
endeavor,v.,"노력, 노력하다",He made a determined effort to improve his grades.
savvy,adj.,"상식, 요령",She is a savvy investor who knows how to make money in the stock market.
impede,v.,지연시키다,The traffic jam impeded our arrival at the concert on time.
appliance,n.,"기기, 가전제품",The microwave oven is a common appliance in modern kitchens.
stationery store,n.,문방구,The stationery store offers a wide range of products for all your writing needs.
deviate,v.,벗어나다,The project deviated from the original plan due to unexpected challenges.
gauge,v.,"게이지, 측정하다",The engineer used a gauge to measure the precise dimensions of the new building.
engaging,adj.,매력적인,The engaging performance of the actor kept the audience captivated.
pursuit,n.,"추적, 뒤쫓음",The detective pursued the suspect through the city streets.
shipment,adj.,배송,"The shipment of goods was delayed due to customs clearance issues."
forge,n.,"구축하다, 대장간",The blacksmith forged a new sword from the hot metal.
conspire,n.,음모를 꾸미다,The two conspirators plotted to overthrow the government.
accompaniment,adj.,"반주, 반찬, 안주, 수반되는 것",The pianist provided accompaniment for the singer's solo performance.
embellish,v.,미화시키다,She embellished her story with fictional details to make it more interesting.
meticulous,adj.,세심한,The scientist's meticulous research methodology ensured accurate results.
litigation,n.,소송,The legal dispute was eventually resolved through litigation.
disparity,adj.,차이,There was a significant disparity between the salaries of the two employees.
embody,v.,구체화하다,The new policy embodied the government's commitment to transparency and accountability.
lure,n.,"꾀다, 유인, 유혹",The fisherman used a lure to catch the fish.
parrot,n.,앵무새,The parrot was trained to repeat words and phrases.
attendant,adj.,종업원,The hotel attendant helped us with our luggage and provided information about the city.
accommodation,n.,숙소,The hotel provided comfortable accommodation for our guests.
artisan,n.,장인,The artisan crafted the wooden furniture with precision and skill.
monopolize,v.,독점하다,The company monopolized the market by acquiring all the competitors.
conglomerate,v.,"집합체, 대기업",The conglomerate merged with another company to form a larger entity.
bureau,n.,"책상, 사무실, 부서",The bureau provided the necessary support for the project team.
quarantine,v.,"격리, 격리하다",The government implemented a quarantine to prevent the spread of the disease.
damp,n.,축축한,The damp weather made it difficult to dry the clothes outside.
blabbermouth,n.,입이 싼 사람,The blabbermouth spilled the secret to the entire office.
indication,n.,지시,The weather forecast indicated a chance of rain later in the day.
advocate,n.,"지지하다, 옹호자",The advocate argued for the rights of the marginalized community.
debris,n.,잔해,The debris from the explosion littered the streets for days after the accident.
retail price,n.,소매 가격,The retail price of the product was significantly lower than the original price.
confiscate,v.,몰수하다,The customs office confiscated the illegal goods and seized the smugglers' boat.
disregard,n.,"무시하다, 무시",He disregarded the warning and continued to drive in the wrong direction.
breed,v.,사육하다,The farmer bred the new breed of cattle to improve the quality of the milk.
mandate,v.,"권한, 명령하다",The government received a mandate from voters to implement healthcare reform.
knowledgeable,adj.,유식한,He was a knowledgeable expert in the field of artificial intelligence.
dismantle,v.,분해하다,The old building was dismantled to make way for a new shopping mall.
ambivalence,n.,양면성,She felt ambivalent about accepting the job offer in another country.
lucrative,adj.,수익성있는,The lucrative new business opportunity was too good to pass up.
feasibility,n.,실현 가능성,The feasibility of the project was thoroughly analyzed before it was approved.
renowned,n.,저명한,The renowned scientist was invited to deliver a keynote speech at the conference.
abide,v.,체류하다,The refugees were allowed to abide by the new regulations in the refugee camp.
foreseeable,adj.,예측할 수 있는,The future of the company was foreseeable after the recent merger.
stall,n.,"마구간, 진열대",The stall was filled with delicious street food and handmade crafts.
commute,v.,"통근하다, 통근, 교환하다",The daily commute to work was a major source of stress for many city dwellers.
inform,n.,알리다,The news was broadcast to inform the public about the upcoming strike action.
deadlock,n.,교착 상태,The negotiations hit a deadlock when both sides refused to compromise.
usher,v.,안내하다,The tour guide ushered the visitors through the museum's most popular exhibits.
overtake,v.,추월하다,The new car model overtook the old one in sales after its release.
dignity,n.,존엄성,The president's dignity was restored after the impeachment trial.
immaculate,v.,티없이 깔끔한,"The immaculate white snow covered the entire city, creating a winter wonderland."
revitalize,v.,"재개발하다, 부활시키다",The city revitalized its downtown area with new restaurants and shops.
hand-me-down,n.,"값싼, 중고의, 중고",She inherited her grandmother’s hand-me-down dress for the wedding.
resignation,n.,"사직, 사임",The resignation of the CEO led to a wave of speculation about the company’s future.
enabling,n.,합법화하는,The new law enabled the government to crack down on illegal activities.
prospective customer,n.,예상고객,The company is targeting prospective customers in the tech-savvy demographic.
deductible,adj.,공제할 수 있는,The insurance policy covered deductibles for medical expenses.
principal,adj.,"주요한, 학장",The principal of the school was responsible for the overall management of the institution.
sonorous,adj.,낭랑한,The sonorous voice of the opera singer filled the concert hall.
conspicuous,adj.,"튀는, 두드러지는",The conspicuous display of wealth at the charity event was a stark contrast to the poverty of the surrounding neighborhoods.
incidental,adj.,부수적인,The incidental damage to the car was covered by the insurance policy.
deem,v.,간주하다,The judge deemed the defendant guilty of the charges.
deep pockets,n.,충분한 자금력,The company had deep pockets and could afford to pay the hefty fine.
be implicated,n.,연루되다,The politician was implicated in the corruption scandal.
under cover of,n.,"~을 틈타서, 엄호 하에","Under cover of darkness, the thieves broke into the museum and stole the valuable artwork."
heritage,n.,유산,The museum's collection of artifacts is a valuable heritage for the city.
household,n.,가정,The household appliances in the kitchen are all made by the same brand.
drawn,n.,"그려진, 당겨진, 지친",The drawing on the wall was drawn by the child as a way to express his feelings.
everlasting,n.,영원한,The everlasting love between the couple was a source of inspiration for many young couples.
superintendent,adj.,지배인,The superintendent of the school was responsible for the overall management of the institution.
tux,n.,턱시도,He wore a tuxedo to the formal event.
resign,v.,사직하다,The CEO resigned from the company after a series of scandals.
easygoing,n.,느긋한,He was an easygoing person who enjoyed spending time with his friends.
suitcase,n.,여행가방,He packed his suitcase with all the essentials for his upcoming vacation.
uptight,n.,"긴장한, 예민한",He was uptight about the upcoming job interview and couldn't sleep the night before.
debit card,n.,직불 카드,He used his debit card to pay for the groceries at the supermarket.
in moderation,n.,알맞게,It’s best to eat in moderation and avoid overindulging.
downtown,n.,시내,The downtown area is home to many of the city’s most popular attractions.
legislation,n.,법률,The new legislation aimed to protect the rights of consumers in the marketplace.
repulse,v.,격퇴하다,The military repulsed the enemy attack and regained control of the territory.
run over,n.,넘치다,The car ran over the speed limit and received a ticket.
consolidate,v.,통합하다,The company consolidated its operations in the region to improve efficiency.
persuasive,adj.,설득력 있는,The persuasive speaker convinced the audience to support the new policy.
wheat,n.,밀,Wheat is a staple food in many countries around the world.
rearing,n.,사육,The farmer was raising a new breed of cattle to improve the quality of the milk.
sculptor,n.,조각가,The sculptor carved a beautiful statue of the goddess of liberty.
procession,n.,행진,"The parade featured a procession of marching bands, floats, and historical reenactors."
sternly,adj.,엄중하게,The teacher sternly reprimanded the student for not completing his homework.
specification,n.,"설명서, 사양",The specifications for the new product were clearly defined in the technical manual.
interdependent,adj.,상호의존적인,"In modern society, many aspects of life are interdependent on each other."
brutality,adj.,"잔인성, 만행",The brutality of the war left a lasting impact on the survivors.
reminisce,n.,추억에 잠기다,He reminisced about the good old days when he was a child.
atttempted,n.,미수에 그친,The attempted robbery ended in failure when the security guards intervened.
encircle,n.,둘러싸다,The police encircled the area to search for the suspect.
monetary,adj.,통화의,The central bank’s monetary policy aimed to control inflation and stabilize the economy.
amphibian,n.,양서류,Amphibians are animals that can live in both water and on land.
unthinkable,adj.,상상할 수 없는,It was unthinkable that the company would go bankrupt so quickly.
convene,v.,소집하다,The government convened an emergency meeting to discuss the situation.
send over,v.,~을 파견하다,The company sent over a team of engineers to troubleshoot the issue.
feel a person's pulse,n.,~의 눈치를 살피다,The doctor carefully felt the patient's pulse to check for any abnormalities.
demoralize,v.,사기를 꺾다,The coach demoralized the team by constantly criticizing their performance.
conceit,n.,자만심,His conceit made him believe he was untouchable.
adore,v.,숭배하다,"I adore the beauty of nature, especially during sunrise and sunset."
fringe benefit,n.,부가 혜택,"The fringe benefits of the job included health insurance and a retirement plan."
hook up with,n.,~와 만나다,"They hooked up with each other at the party last night."
compliment,v.,"칭찬, 칭찬하다","I complimented her on her beautiful dress and asked where she bought it."
designated,n.,지정된,"The designated driver was responsible for ensuring everyone got home safely."
irresolute,n.,우유부단한,"He was irresolute in his decision-making, often changing his mind at the last minute."
timely,adj.,때맞춘,"The timely arrival of the emergency services helped save the lives of the injured."
contingency,adj.,"임시의, 우발, 만일의 사태","In case of an emergency, we have a contingency plan in place."
confidentiality,adj.,기밀,The company’s financial records are kept in strict confidence.
sabotage,v.,파괴하다,"The saboteurs destroyed the equipment and caused significant delays in production."
oat,n.,귀리로 만든,"Oatmeal is a popular breakfast choice for many people."
shimmer,n.,"희미하게 빛나다, 희미한 빛","The shimmer of the lake at night was mesmerizing."
locust,n.,메뚜기,"The locusts swarmed over the crops, destroying them in a matter of days."
feat,n.,"위업, 솜씨, 특징으로 삼다","The feat of climbing Mount Everest was a major achievement for the climber."
weed,n.,잡초,"The gardener carefully weeded the garden to ensure the plants grew healthy and strong."
contestant,n.,참가자,"The contestant gave a heartfelt speech about the importance of education."
reprimand,n.,"질책하다, 징계","The teacher reprimanded the student for not completing his homework on time."
tolerate,v.,용인하다,"I tolerate his behavior, but it's getting annoying."
enact,v.,제정하다,"The new law was enacted to protect the rights of consumers in the marketplace."
stability,n.,안정성,"The stability of the economy is essential for long-term growth."
optimistic,adj.,낙관적인,"I'm optimistic about the future of our company."
archaeologist,n.,고고학자,"The archaeologist discovered ancient artifacts that shed light on the history of the region."
intangible,adj.,무형의,"The value of intangible assets like intellectual property is often difficult to quantify."
take sides,n.,편을 들다,"I took sides with my friend when he was being bullied by the other kids."
openly,adj.,"터놓고, 솔직하게","He spoke openly about his mistakes and learned from them."
provision,v.,"공급, 공급하다","The store provides a wide range of provisions for customers."
encompass,n.,에워싸다,"The new park encompasses a large area, offering plenty of space for outdoor activities."
torture,v.,"고문, 고문하다","The torturer used a variety of techniques to extract information from the prisoner."
culinary,adj.,요리의,"The culinary arts are a passion for many people."
maternity leave,n.,출산휴가,"The company offers a generous maternity leave policy to support new mothers."
peninsula,n.,반도,"The peninsula is a beautiful place to visit, with its unique landscape and wildlife."
affiliate with,v.,~와 제휴하다,"The company affiliated with the university to provide internships for students."
remit,v.,송금하다,"The company remitted the payment to the supplier in a timely manner."
repetitive,adj.,반복적인,"The repetitive tasks were assigned to the new employees to familiarize them with the company."
apron,n.,앞치마,"He put on an apron to protect his clothes while cooking in the kitchen."
respective,adj.,각각의,"Each of us has a respective responsibility in the team."
assessment,n.,평가,"The assessment of the student’s performance was based on his written and oral exams."
earmark,n.,"배정하다, 특징","The company earmarked a portion of its budget for employee training."
dislodge,n.,몰아내다,The new building was designed to dislodge the old one and create a new urban center.
unbeliever,n.,불신론자,He was an unbeliever in the supernatural and believed in science and logic.
urge,v.,"압박하다, 재촉하다","The boss urged the employee to finish the project by the end of the week."
abbreviate,v.,"함축하다, 단축하다","I abbreviated the report to save time and space."
amalgamate,v.,"합병하다, 합치다","The two companies amalgamated to form a larger entity."
expansive,adj.,"포괄적인, 탁 트인","The expansive view from the mountain top offered a panoramic view of the surrounding landscape."
prosperity,adj.,번영,"The country's prosperity has been attributed to its stable political environment."
apprehensive,adj.,"우려되는, 걱정되는, 불안한","The new regulations made many businesses apprehensive about their future."
take over,v.,"인계받다, 탈취하다, 인수하다","The new CEO took over the company and implemented significant changes."
be inaugurated as,v.,~로 취임하다,"The new president was inaugurated as the leader of the country."
cherish,v.,간직하다,"I cherish my memories of traveling to different countries and experiencing different cultures."
shortly,adj.,곧,"I'll be back shortly to pick up the kids."
get a handle on,v.,~을 관리하다,"I'm finally getting a handle on this new project."
binge,n.,폭음/폭식(하다),"I binge-watched the entire season of the new TV show last weekend."
overdue,n.,기한이 지난,"The overdue bill was finally paid by the customer after several reminders."
eligible,adj.,자격이 있는,The new policy is only available to eligible customers.
drop in,n.,잠깐 들르다,"I dropped in on my friend to say hello and catch up on the latest news."
take a rain check on,n.,~에 대해 다음을 기약하다,"I'll take a rain check on the movie, but I'll watch it next week."
vest,n.,조끼,"He wore a vest to protect himself from the cold weather."
regime,n.,"정권, 제도","The current regime is facing increasing pressure from the public."
abundance,n.,풍부,"The abundance of resources in the region made it a desirable location for investment."
firm,n.,"회사, 딱딱한, 다지다",The firm was known for its strict adherence to quality standards.
institution,n.,"기관, 제도",The institution is dedicated to providing education and training to the community.
desirable,adj.,"바람직한, 매력있는",The city's beautiful beaches make it a desirable destination for tourists.
burdensome,adj.,부담스러운,The burdensome workload was causing stress for the employees.
consignment,adj.,"탁송물, 탁송, 배송",The consignment was delayed due to customs clearance issues.
keep coughing,n.,콜록대다,"I kept coughing loudly during the meeting, disturbing everyone."
accommodate,v.,"수용하다, 맞추다","The hotel staff accommodated our request for a late checkout."
compile,v.,"수집하다, 편집하다","The editor compiled the articles into a single volume for publication."
contend,v.,"다투다, 논쟁하다","The two candidates contended for the position of mayor in the upcoming election."
stride,n.,"성큼성큼 걷다, 걸음걸이","He strode confidently down the street, his head held high."
enclose,n.,에워싸다,"The new building was designed to enclose the old one and create a new urban center."
toleration,n.,관용,"Toleration is a fundamental principle of a democratic society."
vow,v.,"맹세, 맹세하다","I vowed to never give up on my dreams and continued to work hard until I achieved success."
retrieve,v.,"되찾아오다, 검색하다, 수습하다","The detective retrieved the stolen documents from the suspect's office."
rye,n.,호밀,"Rye bread is a popular choice for those with gluten intolerance."
historic,adj.,역사적인,"The historic city center is a popular tourist destination."
property,adj.,"재산, 부동산","The property was sold for a record price in the real estate market."
blizzard,n.,눈보라,"The blizzard caused widespread power outages and transportation disruptions."
encounter,n.,맞닥뜨리다,"I encountered a friendly stranger on my morning jog who offered me a cup of coffee."
affecting,adj.,충격적인,"The news of the accident affected everyone in the community deeply."
conceal,adj.,감추다,"I concealed my true feelings and pretended to be happy for her success."
tease,n.,놀리다,"He teased his friend about his clumsy dancing skills."
readiness,n.,준비태세,"The military is ready for any contingency that may arise."
readiness of speech,n.,청산유수,"Politicians often rely on their readiness of speech to persuade the audience."
readiness of wit,n.,임기응변,"His readiness of wit made him the favorite guest at every party."
contaminate,v.,오염시키다,"The polluted water caused widespread illness among the residents."
inordinate,v.,과도한,"His inordinate greed led him to commit a series of crimes."
ethnic,adj.,민족의,"The ethnic diversity of the city was celebrated in the annual festival."
be laid off,v.,실직하다,"The company laid off several employees due to financial difficulties."
approachable,adj.,접근성이 좋은,The CEO is known for his approachable demeanor and willingness to listen to employee concerns.
assort,v.,"분류하다, 구분하다","The store offers a wide assortment of products to meet the needs of customers."
transaction,n.,"거래, 처리","The bank processed thousands of transactions daily to meet customer demand."
at the rate of,n.,~의 비율로,"The price of the product increased at the rate of 10% per month."
deceive,v.,"속이다, 기만하다","The politician deceived the public by promising tax cuts that would only benefit the wealthy."
concurrent,adj.,공존하는,The two projects were scheduled to run concurrently to maximize efficiency.
reluctant,adj.,"꺼리는, 주저하는",He was reluctant to share his true feelings with his friends.
perception,n.,통찰력,His perception of the situation was not as clear as his colleagues'.
oblige,v.,강요하다,The boss obliged the employee to work late without pay.
maturity,adj.,성숙함,The new product is expected to reach maturity in the next few months.
cordially,adj.,다정하게,He greeted me with a cordial smile as I entered the office.
vendor,n.,행상인,The vendor sold his products at a reasonable price and received positive feedback from customers.
give a toast,n.,축배를 들다,"The CEO gave a toast to the employees for their hard work and dedication."
receptionist,n.,안내 직원,"The receptionist greeted me with a warm smile and helped me with my luggage."
incomparable,adj.,비할 데가 없는,"Her beauty was incomparable to any other woman in the room."
shivering,n.,전율,"The cold weather made her shiver as she walked down the street."
interpreting,n.,해석,"The interpreter translated the speech into English for the audience."
spectator,n.,관중,"The soccer match was attended by thousands of spectators, both local and international."
literate,v.,"학식이 있는, 교양있는","He was literate in both English and French, which made him a valuable asset in the company."
landslide,n.,산사태,"The landslide buried the entire village, leaving only a few survivors."
confrontation,n.,"대치, 대립","The political leaders faced a difficult confrontation with the protesters outside the parliament building."
not to mention,n.,말할 것도 없고,"Not to mention the weather, the traffic was also a major challenge."
contiguous,adj.,인접한,"The two countries share a contiguous border, making it easy for trade and travel."
have a crush on,v.,~에게 반하다,"He has a crush on his coworker, but he's too shy to tell her."
execute,v.,"처형하다, 실행하다","The police executed the search warrant on the suspect's home."
shrubbery,adj.,관목,"The park's shrubbery was well-maintained and added to its natural beauty."
abortion,n.,낙태,"The new law legalized abortion, allowing women to make their own choices about their bodies."
