entry,part_of_speech,korean_meaning,example_sentence
corpse,n.,시체,"The corpse was found in the forest, presumably killed by a wild animal."
indulge,v.,탐닉하다,"He indulged in the luxurious lifestyle of the wealthy elite."
fatuous,adj.,얼빠진,"His fatuous comments about the weather made everyone laugh."
edible,adj.,먹을 수 있는,"The edible mushrooms were gathered in the forest for a special dinner."
endemic,adj.,"고유의, 고질적인","The endemic disease was a major public health concern in the region."
commiserate,v.,동정을 표하다,"I commiserated with him over the loss of his beloved pet."
centennial,adj.,100주년의,"The centennial celebration was a grand event that brought together many people from different generations."
vapid,n.,지루한,"The vapid conversation left everyone bored and looking for something more interesting to do."
expeditely,adj.,신속하게,"The company expedited the delivery of the goods to meet the customer’s deadline."
adulterate,adj.,"혼탁한, 불량의","The adulterated milk was sold to unsuspecting customers."
recapitulate,v.,요약하다,"I recapitulated the main points of the speech for my friend who missed it."
depredation,n.,약탈,"The depredation of the wildlife in the forest has caused a decline in the animal population."
tractable,adj.,"유순한, 다루기 쉬운","The tractable horse was perfect for beginning riding lessons."
confidential,adj.,기밀의,"The confidential information was shared only with the authorized personnel."
criterion,n.,기준,"The selection criteria for the scholarship were based on academic performance and financial need."
beverage,n.,음료,"I ordered a beverage to accompany my meal at the restaurant."
mendacity,adj.,"부정직함, 허위","His mendacity led to his downfall in the political race."
gullible,adj.,잘 속는,"He was gullible and easily deceived by the con artist."
plagiarism,n.,표절,"The student was caught plagiarizing the work of another student."
sensuous,adj.,감각적인,"The sensuous dance moves of the performer captivated the audience."
replenish,v.,보충하다,"The company replenished the inventory to meet the demand for the new product."
malevolent,adj.,악의적인,"The malevolent dictator oppressed his people for decades."
headstrong,n.,"고집센, 완고한","He was headstrong and refused to listen to anyone’s advice."
effeminate,v.,"여자같은, 나약한","He was effeminate in his behavior, often using feminine language and gestures."
adorn,n.,꾸미다,"She adorned her home with beautiful flowers and candles for the romantic dinner."
seduce,n.,부추기다,"She seduced him with her charm and beauty, but he was not interested in her."
carnivorous,adj.,육식성의,"The carnivorous lion hunted its prey with precision and agility."
authenticate,n.,인증,"The company used blockchain technology to authenticate the authenticity of their products."
proportion,n.,비율,"The proportion of female employees in the company is increasing every year."
sentient,adj.,민감한,"The sentient being felt pain and suffering, just as we do."
assimilate,v.,"흡수하다, 동화하다","The new immigrants assimilated into the culture of the new country quickly."
discrepancy,adj.,모순,"There was a discrepancy between the reported figures and the actual results."
be saturated,n.,포화된,"The market is saturated with similar products, making it difficult to stand out."
amnesty,adj.,사면,"The government granted amnesty to the prisoners who participated in the uprising."
misdemeanor,n.,"경범죄, 비행","The misdemeanor of the politician was a major scandal that led to his resignation."
lanky,adj.,마른,"He was lanky and tall, with long limbs and a lean body."
capsize,v.,전복시키다,"The boat capsized in the sudden storm, and everyone was rescued safely."
census,n.,인구 조사,"The census data revealed a significant increase in the population of the city."
adduce,v.,제시하다,"I adduced evidence to support my argument."
antagonistic,adj.,적대적인,"The antagonistic relationship between the two countries has been a major source of tension."
foresight,n.,선견지명,"The company's foresight in investing in renewable energy sources has paid off significantly."
lustrous,adj.,윤기가 흐르는,"The lustrous surface of the gemstone reflected the light beautifully."
cannibalism,n.,식인,"The cannibalism of the tribe was a major taboo in their society."
multiracial,adj.,다민족의,"The multiracial society of the city is a reflection of its diverse population."
riverting,n.,관심을 사로잡는,"The riverting fish was a major attraction for tourists in the area."
homogeneous,adj.,"동종의, 균일한","The homogeneous group of students performed well in the standardized test."
impatient,adj.,초조한,"He was impatient and easily irritated by the slow progress of the project."
premonition,n.,예감,"He had a premonition that something bad was about to happen."
invaluable,adj.,"값을 헤아릴 수 없는, 귀중한","The invaluable advice of the mentor helped the entrepreneur succeed in the market."
pretext,n.,핑계,"The politician used the pretext of national security to justify his decision to suspend civil liberties."
beguile,v.,구슬리다,"He beguiled the audience with his charm and wit."
complementary,adj.,상호보완적인,"The complementary products were popular among customers who wanted to save money."
requite,v.,"보답하다, 보복하다","He requited the favor by helping her with her homework."
admonish,v.,꾸짖다,"The teacher admonished the student for not completing the assignment on time."
prevail,v.,만연하다,"The new policy prevailed over the old one, leading to a more efficient workplace."
appease,v.,진정시키다,"The government tried to appease the protesters with minor concessions."
sanctuary,adj.,"사원, 성당, 교회","The sanctuary of the church provided a safe and peaceful environment for the worshippers."
repute,n.,명성,"His reputation as a hardworking employee was well-deserved."
acquit,v.,석방하다,"The jury acquitted the defendant of all charges after a thorough investigation."
sinister,n.,"사악한, 해로운","The sinister plot of the politician was exposed by the media."
magnanimous,adj.,관대한,"He was magnanimous in victory, praising his opponent’s efforts and sportsmanship."
hospitable,adj.,환대하는,"The host made the guests feel at home during their visit to the country."
censorship,n.,검열,"The government implemented strict censorship laws to control the flow of information."
swindle,v.,사취하다,"The con artist swindled the elderly couple out of their life savings."
amateurish,adj.,아마추어같은,"His amateurish performance at the competition was a major disappointment to his fans."
pedestrian,adj.,"보행자, 보행자의","The pedestrian crossing is a safe way to cross the busy street."
prognosticate,v.,예지하다,"The weather forecaster prognosticated a clear and sunny day for the weekend."
criticize,v.,비판하다,"The critic criticized the movie for its unrealistic plot and lack of character development."
mingle,n.,섞이다,"The guests mingled and enjoyed the party atmosphere."
dubious,adj.,수상쩍은,"The dubious financial dealings of the company were eventually exposed by the government."
hoard,v.,"비축물, 비축하다","The hoarders stockpiled essential supplies in anticipation of a natural disaster."
portrait,n.,초상화,"The portrait of the famous artist was a masterpiece of the artist's career."
comparative,adj.,상대적인,"The comparative analysis of the two companies showed that Company A had a stronger market position."
exhortation,n.,"권고, 경고, 훈계","The teacher gave an exhortation to the students to study hard for the upcoming exam."
amend,v.,수정하다,"The company amended its policies to comply with the new regulations."
gingerly,adj.,조심스럽게,"She gingerly stepped on the broken glass to avoid further injury."
immense,n.,엄청난,"The immense pressure of the job made him feel overwhelmed and stressed."
ignominious,adj.,수치스러운,"His ignominious behavior led to his expulsion from the university."
absurd,adj.,우스꽝스러운,"The absurd behavior of the politician was a major scandal that led to his resignation."
idiosyncrasy,adj.,특이습관,"His idiosyncrasy made him a unique character in the office."
diagnosis,n.,진단,"The doctor's diagnosis of the patient's condition was accurate and helped guide the treatment plan."
gregarious,adj.,군집성의,"He is a gregarious person who loves to socialize and make friends."
unanimous,adj.,만장일치의,"The unanimous decision of the committee was a major victory for the project."
divulge,v.,누설하다,"The whistleblower divulged sensitive information about the company’s financial practices."
iniquity,adj.,부당한 것,"The iniquity of the politician's actions was exposed by the media."
commensurate to/with,n.,~에 비례한,"The company's profits are commensurate to the amount of investment they make in research and development."
relentless,adj.,"가차없는, 끊임없는","The relentless pursuit of the criminal led to his eventual capture."
dispatch,n.,파견,"The dispatch of the troops was delayed due to bad weather conditions."
ambivalent,adj.,상반된 감정이 공존하는,"She felt ambivalent about accepting the job offer in another country."
pursue,n.,"추구하다, 뒤쫓다","He pursued his passion for music by playing the guitar every day."
hypodermic,adj.,피하조직의,"The hypodermic needle was inserted into the patient's arm to administer the medication."
folly,adj.,어리석음,"His folly in investing all his money in a risky stock led to a significant loss."
obscure,n.,모호한,"The obscure meaning of the word was debated for hours in the academic circle."
veracious,adj.,정직한,"He is a veracious witness who always tells the truth."
pandemonium,n.,대혼란,"The pandemonium at the airport caused chaos and confusion for travelers."
dent,v.,"움푹 들어간 곳, 훼손하다","The car dent was repaired by the body shop."
alienate,v.,"이간질하다, 소원하게 만들다","He alienated his friends by being too controlling and possessive."
deliberate,v.,"신중한, 숙고하다","He deliberated over the decision for weeks before making a final choice."
ambidextrous,adj.,양손잡이의,"He is ambidextrous and can use both hands equally well."
decipher,v.,판독하다,"The code was so complex that it took a team of experts to decipher it."
congruous,adj.,일치하는,"The new design is congruous with the company’s brand identity."
considerate,v.,사려깊은,"She is a considerate person who always thinks about others before making decisions."
covetous,adj.,탐내는,"He is covetous and always wants more money and possessions."
upright,n.,똑바른,"He is an upright citizen who always follows the law and respects the rights of others."
levelheaded,adj.,이성적인,"He is levelheaded and never gets carried away by his emotions."
devaluate,v.,평가절하하다,"The currency devaluated by 10% due to economic instability."
elucidate,v.,설명하다,"The scientist elucidated the complex process of photosynthesis in the lab."
congregate,v.,모이다,"The congregation gathered for the annual church service."
gratis,n.,무료로,"The restaurant offers a gratis meal to all customers who make a reservation."
evanescent,adj.,덧없는,"The evanescent beauty of the sunset left a lasting impression."
invigorating,n.,활기를 주는,"The invigorating sea breeze refreshed the tired travelers."
imbibe,v.,흡수하다,"The coffee invigorated him and helped him stay awake during the long flight."
manumission,n.,해방,"The slave was granted manumission after serving his master for 20 years."
amiable,adj.,쾌활한,"He is an amiable person who is always willing to help others."
forthright,adj.,단도직입적인,"He is forthright and never beats around the bush."
facet,n.,"면, 측면","The new product has several facets that make it unique and appealing to customers."
psyche,n.,정신,"The psychologist helped the patient understand and cope with their psychological issues."
coax,n.,구슬리다,"He coaxed the cat into the carrier by offering it a treat."
spontaneous,adj.,"자발적인, 즉흥적인","The spontaneous laughter of the children filled the room with joy."
empathy,n.,공감,"She has a deep empathy for the suffering of others and often volunteers at local charities."
simian,adj.,"원숭이의, 유인원의","The chimpanzee's behavior was similar to that of a human, making it a simian species."
deign,v.,우쮸쮸하며 해주는 척 하다,"He deigned to help the poor man, but it was clear he didn't really care."
egregious,adj.,지독한,"The company's egregious disregard for safety regulations was alarming to inspectors."
vacillate,v.,흔들리다,"The politician vacillated on the issue of climate change, changing his position multiple times before making a final decision."
scrupulous,adj.,"세심한, 양심적인","The doctor was scrupulous in his examination of the patient's symptoms."
contemplate,v.,고려하다,"She contemplated the job offer for several days before deciding."
dispute,n.,분쟁,"The dispute between the two countries was resolved through diplomatic negotiations."
qualm,n.,꺼림직함,"He had a qualm about the decision, but ultimately decided to go ahead with it."
fraud,n.,"사기, 사기꾼","The fraudster was caught red-handed when he tried to sell counterfeit goods to the unsuspecting customers."
unsavory,adj.,"불미스러운, 불쾌한","The unsavory comments made by the politician damaged his reputation and led to his downfall."
brace,v.,"버티다, 대비를 하다","He braced himself for the worst possible outcome of the negotiations."
benevolent,adj.,자애로운,"The benevolent act of the charity organization helped many people in need."
deduct,v.,공제하다,"The company deducted the cost of the damaged equipment from the employee's salary."
volition,n.,자유 의지,"The volunteer's volition to help others was the driving force behind their dedication."
enmesh,n.,엮어넣다,"The company's complex organizational structure made it difficult for employees to understand their roles and responsibilities."
posterity,adj.,"후세, 후대","The company's legacy will be remembered for its innovative products and commitment to sustainability."
antipathy,n.,반감,"The politician's antipathy towards the opposition party was well-known to the public."
concord,n.,"화합, 일치","The harmonious relationship between the two countries was a testament to their shared values and goals."
viable,adj.,실행 가능한,"The new technology is viable and has the potential to revolutionize the industry."
insipid,n.,"맛이 없는, 재미없는, 무미건조한","The insipid taste of the soup made it difficult to finish the meal."
consecutive,adj.,연이은,"The consecutive days of rain caused flooding in several areas of the city."
biennially,adj.,2년마다,"The biennial meeting of the United Nations was held in New York last year."
entice,v.,유도하다,"The restaurant enticed customers with a special promotion on their signature dishes."
fabricate,v.,날조하다,"The politician fabricated the evidence to support his claim."
connoisseur,n.,감정가,"He is a connoisseur of fine wines and has a keen eye for identifying authentic vintage bottles."
sacred,adj.,성스러운,"The sacred temple was a place of worship for many followers of the religion."
resemblance,n.,유사함,"The resemblance between the two sisters was striking, even though they were raised in different environments."
rectify,v.,"바로잡다, 정정하다","The teacher rectified the mistakes in the students' homework and provided feedback for improvement."
reckon,v.,"생각하다, 예상하다","He reckoned that the project would take at least a year to complete."
emancipate,v.,해방시키다,"The slave was granted manumission after serving his master for 20 years."
fathom,n.,헤아리다,"He was able to fathom the complexity of the problem and develop a solution that worked for everyone."
consensus,adj.,합의,"There was broad consensus on the plan to reduce greenhouse gas emissions."
capitulate,v.,굴복하다,"The army capitulated after being surrounded by the enemy forces."
deplete,v.,고갈시키다,"The depletion of the ozone layer is a serious environmental concern."
verdict,n.,평결,"The jury delivered a unanimous verdict of guilty for the defendant."
misnomer,n.,부적절한 명칭,"The misnomer of the new product was confusing for customers and led to low sales."
vain,n.,"헛된, 자만심이 강한","His vain attempts to impress the audience only made him look foolish."
savant,n.,학자,"He is a savant with exceptional memory and mathematical abilities."
physiognomy,adj.,관상,"He has a physiognomy that is both unique and striking, making him stand out from others."
overhaul,v.,"점검, 점검하다","The company underwent a thorough overhaul to improve efficiency and reduce costs."
mull,v.,"실수, 숙고하다","He was mulling over the decision for hours before making a final choice."
discourage,n.,의욕을 꺾다,"The coach discouraged the players from taking unnecessary risks during the game."
reminiscent,adj.,연상시키는,"The old photograph reminded him of his childhood memories of playing in the park."
plump,n.,통통한,"The plump panda was a favorite among zoo visitors."
aesthetic,adj.,미적인,"The aesthetic appeal of the building was enhanced by the use of natural materials."
embrace,v.,수용하다,"He embraced the new technology and integrated it into his business operations."
disarmament,adj.,군비 축소,"The disarmament treaty was signed by both countries to reduce tensions and promote peace."
cajole,n.,꼬드기다,"He cajoled the reluctant customer into buying the expensive item with a discount."
sapient,adj.,현명한,"He is a sapient investor who makes sound financial decisions based on market trends and economic indicators."
virtue,n.,"선행, 미덕","The virtue of patience is essential for success in any endeavor."
ratify,v.,"비준하다, 승인하다","The treaty was ratified by both countries after months of negotiations."
incorporate,v.,"설립하다, 포함하다","The company incorporated the new technology into its production process."
unwilling,n.,마지못해 하는,"He was unwilling to accept the job offer, as he had other plans for his career."
disparage,v.,폄하하다,"The critic’s review disparaged the movie as being cliché and unoriginal."
devout,n.,독실한,"He is a devout follower of the religion and attends church regularly."
somatic,adj.,육체의,"The somatic symptoms of the disease were clearly visible on his physical appearance."
recognition,n.,"알아봄, 인정","The recognition of the artist’s work was a significant milestone in his career."
galvanize,v.,"충격 요법을 쓰다, 아연 도금을 하다","The new technology galvanized the entire industry, leading to rapid innovation and growth."
corollary,adj.,필연적인 결과,"The corollary of the decision was that the company would need to invest in new equipment."
vacuous,adj.,"멍청한, 얼빠진","His vacuous speech made it difficult for the audience to understand his message."
ensue,n.,뒤따르다,"The accident ensued shortly after the driver lost control of the vehicle."
rectitude,n.,"정직, 청렴","His rectitude and integrity were well-respected by his colleagues and clients."
docile,n.,유순한,"The horse was docile and easily trained to perform various tricks."
valid,n.,"유효한, 타당한","The new law was valid for three years before it was repealed by the next government."
carnage,n.,대학살,"The war caused widespread carnage and destruction, leaving many families without homes or loved ones."
incalculable,adj.,헤아릴 수 없이 많은,"The amount of damage caused by the natural disaster was incalculable."
innumerable,adj.,셀수없이 많은,"There are innumerable stars in the night sky, making it impossible to count them all."
laden,v.,"잔뜩 실은, 가득한","The ship was laden with goods from all over the world."
deity,adj.,"신, 하느님","The deity is worshipped by the followers as a source of protection and guidance."
illuminate,v.,"비추다, 밝히다","The teacher illuminated the complex theory with simple examples, making it easier for students to understand."
nebulous,adj.,"희미한, 모호한","The nebulous weather conditions made it difficult for pilots to navigate safely."
gourmet,n.,미식가,"He is a gourmet chef who specializes in creating unique and innovative dishes."
fallacious,adj.,틀린,"His fallacious argument was easily refuted by the experts."
resentment,adj.,분노,"He harbored resentment towards his former colleagues for not giving him the promotion he deserved."
avaricious,adj.,탐욕스러운,"His avaricious nature led him to make unethical business decisions."
sanction,v.,"제재, 제재를 가하다","The government sanctioned the company for violating environmental regulations."
outright,adj.,"명백한, 노골적인","The politician's outright lies were exposed by the media, leading to his downfall."
pluralism,adj.,다원주의,"The company adopted a pluralistic approach to hiring, valuing diversity and different perspectives."
precipitate,v.,촉발시키다,"The political instability precipitated a series of economic crises and social unrest."
grudge,v.,"원한, 억울해하다","He harbored a grudge against his former colleague for stealing his idea and taking credit for it."
delve,n.,"뒤지다, 캐다","He delved into the details of the case to uncover the truth."
discord,n.,불협화음,"The discordant sounds of the orchestra filled the concert hall with a sense of excitement and anticipation."
monumental,adj.,기념비적인,"The monumental statue of the leader was a symbol of the country's pride and history."
unquenchable,adj.,막을 수 없는,"The unquenchable thirst of the desert traveler led him to drink from the oasis."
soothe,n.,달래다,"The soothing melody of the piano calmed the agitated child and helped him fall asleep."
rummage,n.,"뒤지다, 뒤적거리다","He rummaged through his closet to find his favorite shirt."
manifest,n.,명백한,"The manifesto clearly stated the goals and objectives of the organization."
concoct,n.,합성해내다,"The chef concocted a new dish using ingredients from different cultures."
retreat,v.,"후퇴, 후퇴하다","The army retreated to the mountains after the battle was lost."
foreboding,n.,"예언, 육감","The foreboding look in his eyes warned us that something bad was about to happen."
ransack,n.,샅샅이 뒤지다,"He ransacked the house looking for his missing keys."
eccentric,adj.,"괴짜인, 별난","The eccentric artist's unique style set him apart from other contemporary artists."
treachery,adj.,배반,"The treacherous act of betraying his friend led to his downfall and imprisonment."
swarm,n.,떼,"The swarm of bees was a beautiful sight to behold."
altruistic,adj.,이타적인,"He was an altruistic doctor who dedicated his life to helping others."
implement,v.,"도구, 시행하다","The new policy was implemented to improve the efficiency of the company."
misery,adj.,"궁상, 고통","The misery of the refugees was evident in their faces as they waited for food and shelter."
conscience,n.,양심,"The thief felt a pang of conscience as he stole the money from the store."
dub,v.,더빙하다,"The actor dubbed his lines to match the actor's original voice."
condense,v.,"응축, 응축하다","The condensed version of the novel was published as a paperback edition."
doctrine,n.,"교의, 교리","The doctrine of the religion was based on the principles of love and compassion."
figurehead,n.,"선수상, 허수아비","The figurehead of the company was responsible for representing the company to the public."
lenient,adj.,관대한,"The judge was lenient in sentencing the convicted criminal."
perfidy,adj.,배신,"His perfidy led to the collapse of the company and the loss of his reputation."
complimentary,adj.,무료의,"The complimentary breakfast buffet was a popular attraction for guests."
charlatan,n.,"돌팔이, 사기꾼","The charlatan promised to cure his patients with a magic potion, but it was just a placebo."
cognizant,adj.,인지하는,"He is cognizant of the risks involved in his business decisions and takes steps to mitigate them."
imbecility,adj.,우둔함,"The imbecility of the politician's decision-making was evident in the disastrous results of his policies."
norm,n.,규범,"The norm in the company is to dress professionally for work."
traitorous,adj.,반역의,"His traitorous actions led to his arrest and imprisonment."
dissent,adj.,"이의를 말하다, 이의","The dissenting voices of the minority were ignored by the majority."
notorious,adj.,악명높은,"The notorious criminal was finally caught and brought to justice."
disgrace,n.,불명예,"The politician's corruption and scandals brought disgrace upon his family and the nation."
no-nonsense,adj.,현실적인,"The no-nonsense approach of the CEO helped the company weather the economic downturn."
forage,n.,"사료, 먹이를 찾다","The foraging bear was looking for food in the forest."
persecute,v.,박해하다,"The religious minority was persecuted by the government for their beliefs."
monopoly,adj.,"독점, 전유물","The company's monopoly on the market allowed it to set prices and control supply."
fidget,n.,꼼지락거리다,"He fidgeted with his hands as he waited for the meeting to start."
hostile,adj.,적대적인,"The two countries have been in a state of hostile relations for decades."
presage,n.,전조가 되다,"The ominous weather forecast presaged a severe storm."
