entry,part_of_speech,korean_meaning,example_sentence
competitive,adj.,"경쟁력있는, 경쟁의","The company's products are highly competitive in the market, thanks to their innovative features."
porridge,n.,죽,"Porridge is a popular breakfast choice in many countries, especially in winter."
cremation,n.,"화장, 화장 장례식","The funeral ceremony included a cremation of the deceased's remains."
installment plan,n.,할부,"The bank offers a flexible installment plan for customers who want to purchase expensive items."
district,n.,구역,"The district office is responsible for providing essential services to the residents."
deteriorate,v.,악화되다,"The economy has deteriorated significantly due to the global financial crisis."
uphold,v.,"유지하다, 지지하다","The president's approval ratings have held steady despite the economic downturn."
preemptive,adj.,선제의,"The company implemented a preemptive strike to gain a competitive advantage in the market."
stagnant,adj.,고여 있는,"The stagnant economy has led to high unemployment rates and economic instability."
transferable,adj.,"이동가능한, 양도 가능한","The company's stock is transferable on the stock exchange, allowing investors to buy and sell easily."
garner,n.,얻다,"The company's efforts to improve customer satisfaction have resulted in increased sales and customer loyalty."
stare,n.,빤히 쳐다보다,"He stared at me with a look of disbelief, as if I had just told him a crazy story."
prolong,v.,연장하다,"I prolonged my vacation by adding a few extra days to my trip."
comparatively,adj.,비교적,"Compared to other countries, our economy is relatively stable."
migraine,n.,편두통,"I suffer from migraines, which can be debilitating and make it difficult to function normally."
porter,n.,짐꾼,"The porter carried my heavy luggage up to my room at the hotel."
retirement,adj.,은퇴,"He retired from his career after working for 30 years in the same company."
sweep,n.,쓸다,"I swept the floor clean before the guests arrived."
for ages,n.,오랫동안,"The company has been in business for over 100 years, making it one of the oldest companies in the industry."
comprehensive,adj.,포괄적인,"A comprehensive study on climate change is needed to understand its impact on global weather patterns."
nun,n.,수녀,"The nun served as a bridge between the community and the local church."
hang out with,n.,~와 시간을 보내다,"I hang out with my friends at the park every weekend."
spouse,n.,배우자,"My spouse and I have been married for 20 years and we still enjoy each other's company."
expenditure,n.,지출,"The company's expenditure on research and development has increased significantly in recent years."
delegate,v.,대표,"The CEO delegated the responsibility of handling customer complaints to a dedicated team."
get a head start,n.,앞서가다,"Get a head start on your morning routine by waking up 30 minutes earlier."
intense,n.,격렬한,"The intense training regimen prepared the athletes for the grueling competition."
commitment,adj.,"약속, 일정","My commitment to the project is unwavering, even in the face of challenges."
dismiss,n.,해고,"The company dismissed several employees due to financial difficulties."
deterioration,n.,악화,"The economy has deteriorated significantly due to the global financial crisis."
external,adj.,외부의,"The company's external auditors performed a thorough review of the financial statements."
resolution,n.,"결의안, 해결","The board of directors passed a resolution to approve the new marketing strategy."
multilateral,adj.,다자간의,"The multilateral trade agreement between the countries aims to promote economic cooperation and stability."
stain,v.,"얼룩, 얼룩지게 하다","The stain on the carpet was difficult to remove, even with a professional cleaner."
proactive,adj.,주도하는,"The company implemented a proactive strategy to prevent potential risks before they occurred."
unprecedented,n.,전례없는,"The unprecedented natural disaster caused widespread devastation and forced the government to implement emergency measures."
put A over on B,n.,B 머리위에 A를 놓다 (속이다),"He put his competitor over on him by offering a better deal."
detour,n.,"우회하다, 우회로","The road was diverted due to a major accident, causing significant traffic delays."
discolor,n.,"변색시키다, 바래다","The paint on the wall discolored after exposure to sunlight."
accord,v.,"합의, 부합하다","We reached an accord on the terms of the contract after several days of negotiations."
marble,n.,"대리석, 구슬","The marble statue was a masterpiece of ancient Greek art."
demolish,v.,철거하다,"The old building was demolished to make way for a new shopping mall."
intentional,adj.,의도적인,"The intentional act of vandalism caused significant damage to the historic building."
colonial,adj.,식민의,"The colonial era left a lasting impact on the culture of the region."
facilitate,v.,촉진하다,"The new software will facilitate communication between departments."
optimism,adj.,낙관주의,"I have a lot of optimism about the future of our business."
persist,v.,집요하게 계속하다,She persisted in her efforts to convince the company to invest in her new technology.
disposal,adj.,"처리, 처분","The company disposed of the old equipment to make way for new technology."
presumably,adj.,짐작건대,"Apparently, he didn't know the answer, but he pretended to know it."
aide,n.,보좌관,"The aide provided valuable support to the president during his busy schedule."
competent,adj.,능숙한,He is a competent teacher who can handle any situation in the classroom.
even-minded,n.,차분한,He was an even-minded leader who made decisions based on reason and logic.
proficiency,adj.,숙달,She had a high level of proficiency in both English and French.
denounce,v.,"몰아세우다, 고발하다",He was denounced by the community for his unethical behavior.
go out,v.,"외출하다, 탈락하다",He went out of his way to help the injured person.
satisfactory,adj.,만족스러운,"The customer service was satisfactory, but not exceptional."
warranty,adj.,"보증, 근거","The warranty on the product was valid for one year from the date of purchase."
at a fraction of cost,n.,저렴한 가격에,"The new phone was available at a fraction of the cost of the previous model."
tranquil,n.,고요한,"The tranquil beach was the perfect place to relax and unwind."
aggravate,v.,악화시키다,His comments aggravated the situation and made it more difficult to resolve.
daunt,n.,기를 죽이다,The difficult task daunted him and he felt overwhelmed by the pressure.
bargain,n.,"흥정하다, 값싼 물건","He negotiated a good deal on the price of the car."
pervasive,adj.,만연하는,"The pervasive use of social media has changed the way people communicate and share information."
compliance,n.,"준수, 따름","The company's compliance with environmental regulations was closely monitored by the government."
yield,v.,"산출하다, 야기하다","The new crop yield was significantly higher than expected, resulting in a bumper harvest."
sophisticate,v.,세련된 사람,"He was a sophisticated gentleman who always dressed impeccably."
condemn,v.,규탄하다,"The politician was condemned by the public for his corrupt behavior."
devoted,adj.,헌신적인,"She was devoted to her family and always put their needs before her own."
accomplice,n.,공범,"He was an accomplice to the crime and helped hide the evidence."
reinstate,v.,복귀시키다,"The company reinstated the employee after he completed the required training program."
choreography,adj.,안무,"The choreographer created a visually stunning performance with intricate dance moves."
accession,n.,"취임, 가입","The accession of the new king to the throne was celebrated with a grand ceremony."
utilization,n.,사용,"The company utilized the new technology to improve efficiency and reduce costs."
remittance,n.,"송금액, 송금","The remittance of the money to the family in the Philippines was a major concern for the migrant worker."
groom,v.,손질하다,"He groomed his dog before taking it for a walk in the park."
temptation,n.,유혹,"The temptation of the money was too great for him to resist."
beat a dead horse,v.,헛수고하다,"Don't beat a dead horse; it's not going to get better."
installation,n.,"설치, 장치","The new software was installed on all the computers in the office."
strategic,adj.,전략적인,"The strategic location of the company's headquarters gave it a competitive advantage in the market."
skepticism,n.,"의심, 회의감","He expressed skepticism about the new technology, saying it was not yet proven to be effective."
jeopardize,v.,위태롭게 하다,"The decision to cut funding for education jeopardized the future of the students."
historical,adj.,역사의,"The historical artifacts were carefully preserved to ensure their authenticity."
domestic,adj.,"국내의, 내수의","The domestic market is growing rapidly, driven by increasing consumer demand."
continental,adj.,대륙의,"The Continental Divide separates the Atlantic and Pacific Oceans."
extinct,n.,멸종된,"The dinosaurs became extinct millions of years ago due to natural disasters."
deterrence,n.,"저지, 억제","The government's efforts to deter illegal immigration have been successful in recent years."
revelation,n.,"계시, 폭로, 드러냄","The revelation of the scandal shocked the entire nation."
in tandem,n.,함께,"The two countries worked in tandem to develop a new vaccine against the disease."
fabric,adj.,"직물, 기본 구조","The fabric of the dress was made from a high-quality material."
stuck in traffic,adj.,차가 막히는,"I got stuck in traffic for hours on my way to work this morning."
rub,n.,문지르다,"He rubbed the sore spot on his knee to relieve the pain."
sneeze,n.,"재채기하다, 재채기","I sneezed loudly in the library and everyone looked at me strangely."
obligation,n.,의무,"I have an obligation to my family to provide for them."
regular price,n.,정가,"The regular price of the product is $100, but with the discount, it's only $80."
revenue,n.,"수입, 수익","The company's revenue has increased by 10% in the last quarter."
gender discrimination,n.,성차별,"The company was accused of gender discrimination in its hiring practices."
prompt,v.,촉진하다,"The new policy was designed to prompt businesses to reduce pollution and improve energy efficiency."
liberal,adj.,자유민주적인,"The liberal approach to immigration allowed for a diverse population in the country."
slaughter,n.,"도살, 살육","The slaughter of animals for food is a common practice in many countries."
antibiotic,adj.,항생제,"Antibiotics are used to treat bacterial infections."
crutch,n.,목발,"He uses a crutch to support his injured leg."
excessive,adj.,지나친,"The excessive use of antibiotics has led to the development of antibiotic-resistant bacteria."
withstand,n.,견뎌내다,"He can withstand the pressure of the job and keep his cool under any circumstances."
vacant,adj.,비어있는,"The vacant position was filled by a qualified candidate."
stroll,n.,거닐다,"I enjoy taking a stroll along the beach in the evenings to clear my mind."
courteous,adj.,공손한,"He is a courteous gentleman who always holds the door open for others."
precious,adj.,귀중한,"The precious gemstone was worth millions of dollars."
majority,adj.,다수,"The majority of the population voted for the new policy."
shaky,adj.,떨리는,"His hands were shaky as he signed the document."
dilute,v.,희석하다,"I diluted the solution by adding more water to it."
observance,n.,"준수, 축하","I will observe the national holiday by staying home and spending time with my family."
beforehand,n.,사전에,"I made sure to bring my passport and other important documents with me before I left the house."
come across,n.,인상을 주다,"He came across as a confident and charismatic leader during the interview."
transition,n.,"이행, 전이","The transition from the old system to the new one was smooth and seamless."
bid,n.,"값을 부르다, 호가","The auctioneer bid $100,000 for the painting."
pessimistic,adj.,비관적인,"She is a pessimistic person who always sees the worst in every situation."
consciousness,n.,의식,"I have a strong sense of consciousness about the environment and sustainability."
secretary,adj.,비서,"She is a dedicated secretary who always goes the extra mile to help her boss."
politics,n.,정치,"The new government has been embroiled in political scandals since its inception."
brisk,n.,"바쁜, 딱딱한","The brisk morning air invigorated me as I started my run."
affix,v.,부착하다,"I affixed the flag to the pole so it would fly in the wind."
operational,adj.,작전의,"The military operation was carried out with precision and efficiency."
comply,adj.,따르다,"The new regulations require all businesses to comply with the new safety standards."
reproach,v.,비난하다,"I reproached him for his careless attitude towards the project."
profession,n.,"직업, 전문직","He is a professional chef who specializes in Italian cuisine."
barely,adj.,간신히,"I barely passed the exam, but I'm still waiting for the results."
disinfect,v.,소독하다,"The hospital staff disinfected the operating room before each surgery."
sleek,n.,윤이 나는,"The sleek design of the car made it stand out from the competition."
outlook,n.,"관점, 전망","His outlook on life was positive and he always looked for the bright side of things."
coherent,adj.,일관성있는,"His speech was coherent and easy to understand, despite being complex and technical."
cozy,adj.,아늑한,"The cozy atmosphere of the cafe made me feel relaxed and at ease."
wholesale price,n.,도매 가격,"The wholesale price of the product is much lower than the retail price."
embezzlement,adj.,횡령,"The company was accused of embezzling funds from the employee pension fund."
as well,n.,"~또한, ~역시","As well as being a software engineer, he is also a talented musician."
respondent,n.,응답자,"The survey included a question about the respondent's opinion on the new policy."
hesitant,adj.,주저하는,"He was hesitant to speak up in the meeting, but eventually shared his thoughts."
prospective buyer,n.,예상 구매자,"The prospective buyer was interested in the property and made an offer immediately."
seasoned,n.,경험 많은,"He is a seasoned politician who has been in office for many years."
deficit,n.,적자,"The company reported a significant deficit in its financial report last quarter."
exclude,v.,제외하다,"The company excluded employees who were not performing well from the bonus pool."
as a matter of fact,n.,사실은,"As a matter of fact, I don't like coffee."
assure,v.,장담하다,"I assure you that the project will be completed on time."
inspect,v.,"조사하다, 점검하다","The inspector thoroughly inspected the warehouse to ensure it met safety standards."
be famished,n.,굶주리다,"She was so famished that she ate everything on her plate."
push ~ into a corner,n.,궁지에 몰아넣다,"The police pushed the suspect into a corner and arrested him."
assortment,adj.,"모음, 종합","The store had a wide assortment of products for customers to choose from."
prejudice,n.,편견,"His prejudice against foreigners made him unable to understand their culture."
at it,n.,착수하여,"Let's get this project at it and finish it on time."
rung,n.,"단계, 순위","The project is currently at the planning stage, which is the first rung of the ladder."
reimburse,n.,환급받다,"He was reimbursed for the expenses incurred while on business trip."
hectic,adj.,정신없이,"The hectic schedule of the CEO made it difficult for him to focus on his family."
lawn,n.,잔디,"The lawn was perfectly manicured and ready for the upcoming summer party."
impair,v.,손상시키다,"The accident impaired the driver's ability to control the vehicle."
storage,n.,저장,"The company's storage facilities are equipped with the latest technology to protect sensitive data."
hollow,n.,빈,"The hollow wooden box was used to store the company's confidential documents."
whopper,n.,엄청 큰 것,"The whopper of the day was the news that the company had been hacked."
ailing,n.,병든,"The patient's condition was critical and he was in the hospital for treatment."
exaggerate,v.,과장하다,"The politician exaggerated the benefits of the new policy to win over the voters."
dignitary,adj.,고위 관리,"The dignitary was welcomed with great respect and honor by the people."
extinguish,adj.,"끄다, 끝내다","The fire was extinguished quickly using the fire extinguisher."
manipulate,v.,"조종하다, 조작하다","The politician manipulated the media to promote his agenda."
vestige,n.,흔적,"The vestige of the old building still stands as a reminder of the past."
evaporate,v.,증발하다,"The water evaporated quickly in the hot sun."
tranquility,adj.,평온,"The tranquil lake reflected the beautiful sunset, creating a serene atmosphere."
inspiration,n.,영감,"The artist's inspiration came from the natural beauty of the landscape."
devastate,v.,완전히 파괴하다,"The earthquake devastated the city, leaving a trail of destruction in its wake."
placid,n.,차분한,"The placid lake was a perfect place for a peaceful afternoon walk."
pensive,adj.,사색에 잠긴,"He was lost in thought, deep in concentration."
succulent,adj.,즙이 많은,"The succulent fruit was juicy and sweet, perfect for a summer snack."
cognitive,adj.,인식의,"The cognitive abilities of the elderly population are declining as they age."
weigh,n.,무게를 달다,"I weighed the pros and cons of the decision before making a final choice."
amass,n.,모으다,"I amassed a collection of rare books over the years."
ferocious,adj.,격렬한,"The ferocious tiger was a fearsome sight in the jungle."
fidelity,adj.,"충성, 신의","The fidelity of the relationship was tested when they faced a difficult financial situation."
mnemonic,adj.,연상 기호,"The mnemonic device helped me remember the names of the planets in the solar system."
lenitive,adj.,"진정시키는, 진정제","The lenitive medication helped relieve the patient's pain."
respiratory,adj.,호흡 기관의,"The respiratory system is responsible for breathing and gas exchange in the body."
placebo,n.,"속임약, 위약","The placebo effect is a phenomenon where people experience a positive outcome simply because they believe they are receiving a treatment."
unwittingly,adj.,자신도 모르게,"He unwittingly revealed his true intentions to the enemy."
oblivious,adj.,의식하지 못하는,"He was oblivious to the danger until it was too late."
cordial,adj.,화기애애한,"He was known for his cordial and friendly nature, making everyone feel welcome."
esteem,v.,"존경, 존경하다","I esteem the value of hard work and dedication in achieving success."
capitalize,v.,"대문자로 쓰다, 자본화하다","The company capitalized on the opportunity to expand its operations in the region."
fudge,n.,얼버무리다,"I fudged the numbers on my tax return to avoid paying more taxes."
estrangement,adj.,"불화, 별거","The estrangement between the two friends eventually led to their separation."
obsequious,adj.,아부하는,"He was known for his obsequious behavior, always eager to please his superiors."
obesity,adj.,비만,"The obesity epidemic has become a major public health concern."
divine,n.,신성한,"The divine intervention saved the city from the flood."
waive,v.,포기하다,"He waived his right to appeal the decision and accepted the penalty."
consequential,adj.,"필연적인, 중대한","The consequences of the decision were far-reaching and had to be carefully considered."
amicable,adj.,우호적인,"The two countries reached an amicable agreement on trade negotiations."
discard,n.,버리다,"I discarded the old furniture and replaced it with new ones."
perimeter,n.,"주위, 둘레","The perimeter of the park was carefully monitored to ensure public safety."
idolize,v.,숭배하다,"I idolized my favorite singer and bought all of his albums."
ruthless,adj.,무자비한,"The ruthless dictator used terror tactics to maintain control over his people."
compassion,n.,연민,"She showed great compassion towards the victims of the natural disaster."
amenable,adj.,순종적인,"He was amenable to the suggestions of his colleagues and made adjustments to his work."
clement,adj.,온화한,"The judge showed clemency by reducing the sentence for the first-time offender."
efface,n.,지우다,"I effaced the mistake on the test paper to avoid getting a lower grade."
voracious,adj.,게걸스러운,"The voracious reader devoured the entire novel in one sitting."
lucid,n.,명쾌한,"His lucid explanation helped me understand the complex concept."
apathetic,adj.,무관심한,"She was apathetic about the upcoming election and didn't bother to vote."
agnostic,adj.,불가지론의,"He was agnostic about the existence of God."
acquiesce,v.,"마지못해 따르다, 묵인하다","He acquiesced to the demands rather than face further confrontation."
inane,n.,어리석은,"His inane comments about the weather made everyone laugh."
inscrutable,adj.,헤아릴 수 없는,"His inscrutable expression made it difficult to read his true intentions."
sentinel,n.,"보초, 감시","The sentinel kept a close watch on the border area to prevent any unauthorized crossings."
bilateral,adj.,쌍방의,"The bilateral trade agreement between the two countries has boosted economic growth."
excoriate,v.,심하게 비난하다,"The teacher excoriated the student for not completing the assignment on time."
copycat,n.,모방자,"The copycat artist copied the style of the famous painter and sold the paintings for a high price."
decorous,adj.,예의바른,"She was known for her decorous behavior at formal events."
stultify,v.,바보처럼 보이게 하다,"His stultifying comments made everyone feel uncomfortable."
capricious,adj.,변덕스러운,"Her capricious behavior often left her friends bewildered and confused."
censure,n.,"견책, 징계, 비난","The committee voted to censure the politician for his inappropriate behavior."
hoax,n.,거짓말,"The fake news article was a hoax and spread widely on social media."
atheist,n.,무신론자,"He was an atheist and didn't believe in the existence of God."
allowance,n.,"예산, 용돈","The allowance given to the child was not enough to cover all of his expenses."
desecrate,v.,훼손하다,"The sacred temple was desecrated by vandals who defaced the walls with graffiti."
alias,n.,"가명, 별명","He uses an alias to protect his privacy online."
precipitation,n.,"강수, 강수량, 침전","The precipitation in the area was heavy, causing flooding and landslides."
flaw,n.,결함,"The new software has a few minor flaws that need to be fixed."
charitable,adj.,"자선의, 너그러운","The charitable organization provides financial assistance to those in need."
distraction,n.,"산만함, 방심","The distraction of social media made it difficult to focus on work."
faulty,adj.,결함이 있는,"The faulty wiring caused a fire in the building."
amity,adj.,친목,"The two countries established amity through diplomatic negotiations."
aftermath,n.,여파,"The aftermath of the war was a long and difficult process of rebuilding the country."
indecent,adj.,음란한,"The indecent behavior of the politician shocked the public and led to his resignation."
emulate,v.,모방하다,"She emulated the graceful movements of the ballerina on stage."
sensible,adj.,"센스있는, 합리적인","She is a sensible person who makes decisions based on logic and reason."
segregate,v.,분리하다,"The school segregated students based on their academic performance."
trait,n.,특성,"Each person has unique traits that make them who they are."
commencement,adj.,시작,"The commencement ceremony marked the end of four years of hard work for the graduates."
execution,n.,"처형, 실행","The execution of the death sentence was carried out in a humane manner."
hind,n.,"뒤의, 암사슴","The hind of the deer was visible in the distance."
revere,v.,숭배하다,"I revere the wisdom of the ancient philosophers and their contributions to society."
menial,adj.,하찮은,"The menial job required repetitive tasks that were physically demanding."
vulgar,n.,저속한,"The vulgar language used by the politician offended many people."
knowingly,adj.,고의로,"He knowingly broke the law by driving under the influence of alcohol."
muse,v.,사색하다,"He spent hours musing about the meaning of life and the universe."
draft,n.,원고,"The draft of the novel was rejected by the publisher due to its lack of originality."
preposterous,adj.,엉뚱한,"His preposterous suggestion was met with laughter and disbelief."
incompatible,adj.,양립할 수 없는,"The incompatible schedules of the two partners made it difficult to coordinate their work."
winnow,n.,걸러내다,"The winnowing process separated the wheat from the chaff."
sip,n.,홀짝이다,"He sipped on the wine while watching the sunset over the ocean."
vital,adj.,필수적인,"The vital organs of the body are essential for maintaining life."
prevalent,adj.,널리 퍼진,"The widespread use of social media has made it difficult to maintain privacy."
expire,n.,만료되다,"The expiration date of the medicine was approaching, so it needed to be used soon."
convalescence,n.,회복기,"The convalescence period for the injured soldier was expected to be long and difficult."
hinder,v.,방해하다,"His actions hindered the progress of the project."
spurious,adj.,위조의,"The spurious documents were used to deceive the authorities."
